"Type","SousType","Nom","Description","Addresse","Link","E-mail","Id-Media","Comm Urb","Latitude","Longitude"
"Tourisme_Culture","Jardins","Giardini Comunali Monsignor Tommaso Reggio","Ristrutturati nel 2006 con il progetto ""Les Jardins des Alpes"", i Giardini sono intitolati a Monsignor Tommaso Reggio, dichiarato Beato da Giovanni Paolo II, vescovo della Città di Ventimiglia  tra il 1877 e il 1892. Al suo interno sono conservati numerosi esemplari di palma (Phoenix canariensis) messe a dimora dal botanico tedesco Winter, noto per l'omonimo giardino di Bordighera. ","Lungo Roia Girolamo Rossi/Via Vitt. Veneto",,,,"Vintimille","43.789785","7.607847"
"Tourisme_Culture","Jardins","Giardino Botanico Hanbury","Fondati nella seconda metà del 1800 dal nobile inglese Sir Thomas Hanbury  sul promontorio della Mortola,  i Giardini occupano una superficie di 18 ettari.  L'aspetto paesaggistico è tipicamente all'inglese, con vialetti irregolari e romantici , rustici pergolati e patii ed una pittoresca vista del mare sullo sfondo. In questo angolo di paradiso hanno trovato ambientazione specie arboree provenienti da diverse parti del mondo.","Corso Montecarlo, 43 - Località La Mortola        Tel: +39 0184 229292",,,,"Vintimille","43.783725","7.553709"
"Tourisme_Culture","Jardins","Oasi naturalistica del Torrente Nervia","Unico esempio nella Provincia di Imperia di habitat umido costiero. Si estende per 60.000 mq. e vi sono censite 160 specie botaniche tra le quali spiccano  il pioppo nero, il salice, l'ontano e l'esteso canneto a cannuccia di palude e circa 140 specie di uccelli tra cui aironi, svassi, anatre, limicoli ecc. anfibi, rettili e mammiferi. E' sito di interesse comunitario (SIC ) e costituisce tappa intermedia per numerose specie migratorie .","Rotonda di Via Dante Alighieri sita  nei pressi della foce del Torrente Nervia.",,,,"Vintimille","43.787005","7.631525"
,,,,,,,,,,
,,,,,,,,,,
